{
    "$schema": "../../Source/Schemas/2021-04/schema.definition.json",
    "contentVersion": "1.0.0.0",
    "parameters": {
        "subscriptionId": {
            "type": "string"
        },
        "resourceGroupName": {
            "type": "string"
        },
        "vmSize": {
            "type": "string",
            "defaultValue": "Standard_A1_v2",
            "metadata": {
                "description": "The size for both Windows and Linux virtual machines."
            }
        },
        "hubNetwork": {
            "type": "object",
            "defaultValue": {
                "name": "vnet-hub",
                "addressPrefix": "10.0.0.0/20"
            }
        },
        "spokeNetwork": {
            "type": "object",
            "defaultValue": {
                "name": "vnet-spoke-one",
                "addressPrefix": "10.100.0.0/16",
                "subnetName": "snet-spoke-resources",
                "subnetPrefix": "10.100.0.0/16",
                "subnetNsgName": "nsg-spoke-one-resources"
            }
        },
        "spokeNetworkTwo": {
            "type": "object",
            "defaultValue": {
                "name": "vnet-spoke-two",
                "addressPrefix": "10.200.0.0/16",
                "subnetName": "snet-spoke-resources",
                "subnetPrefix": "10.200.0.0/16",
                "subnetNsgName": "nsg-spoke-two-resources"
            }
        },
        "vpnGateway": {
            "type": "object",
            "defaultValue": {
                "name": "vgw-gateway",
                "subnetName": "GatewaySubnet",
                "subnetPrefix": "10.0.2.0/27",
                "pipName": "pip-vgw-gateway"
            }
        },
        "bastionHost": {
            "type": "object",
            "defaultValue": {
                "name": "AzureBastionHost",
                "publicIPAddressName": "pip-bastion",
                "subnetName": "AzureBastionSubnet",
                "nsgName": "nsg-hub-bastion",
                "subnetPrefix": "10.0.1.0/29"
            }
        },
        "azureFirewall": {
            "type": "object",
            "defaultValue": {
                "name": "AzureFirewall",
                "publicIPAddressName": "pip-firewall",
                "subnetName": "AzureFirewallSubnet",
                "subnetPrefix": "10.0.3.0/26",
                "routeName": "r-nexthop-to-fw"
            }
        },
        "location": {
            "type": "string",
            "defaultValue": "northeurope"
        }
    },
    "contexts": {
        "default": {
            "subscriptionId": "{parameters.subscriptionId}",
            "resourceGroupName": "{parameters.resourceGroupName}"
        }
    },
    "definition": {
        "network": {
            "virtualNetworks": [
                {
                    "name": "{parameters.hubNetwork.name}",
                    "addressSpace": [
                        {
                            "addressPrefix": "{parameters.hubNetwork.addressPrefix}"
                        }
                    ],
                    "subnets": [
                        {
                            "name": "{parameters.azureFirewall.subnetName}",
                            "addressPrefix": "{parameters.azureFirewall.subnetPrefix}"
                        },
                        {
                            "name": "{parameters.bastionHost.subnetName}",
                            "addressPrefix": "{parameters.bastionHost.subnetPrefix}"
                        },
                        {
                            "name": "{parameters.vpnGateway.subnetName}",
                            "addressPrefix": "{parameters.vpnGateway.subnetPrefix}"
                        }
                    ],
                    "virtualNetworkPeerings": [
                        {
                            "name": "hub-to-spoke-one",
                            "remoteVirtualNetwork": {
                                "name": "{parameters.spokeNetwork.name}"
                            }
                        },
                        {
                            "name": "hub-to-spoke-two",
                            "remoteVirtualNetwork": {
                                "name": "{parameters.spokeNetworkTwo.name}"
                            }
                        }
                    ]
                },
                {
                    "name": "{parameters.spokeNetwork.name}",
                    "location": "{parameters.location}",
                    "addressSpace": [
                        {
                            "addressPrefix": "{parameters.spokeNetwork.addressPrefix}"
                        }
                    ],
                    "subnets": [
                        {
                            "name": "{parameters.spokeNetwork.subnetName}",
                            "addressPrefix": "{parameters.spokeNetwork.subnetPrefix}"
                        }
                    ],
                    "virtualNetworkPeerings": [
                        {
                            "name": "spoke-one-to-hub",
                            "remoteVirtualNetwork": {
                                "name": "{parameters.hubNetwork.name}"
                            }
                        }
                    ]
                },
                {
                    "name": "{parameters.spokeNetworkTwo.name}",
                    "location": "{parameters.location}",
                    "addressSpace": [
                        {
                            "addressPrefix": "{parameters.spokeNetworkTwo.addressPrefix}"
                        }
                    ],
                    "subnets": [
                        {
                            "name": "{parameters.spokeNetworkTwo.subnetName}",
                            "addressPrefix": "{parameters.spokeNetworkTwo.subnetPrefix}"
                        }
                    ],
                    "virtualNetworkPeerings": [
                        {
                            "name": "spoke-two-to-hub",
                            "remoteVirtualNetwork": {
                                "name": "{parameters.hubNetwork.name}"
                            }
                        }
                    ]
                }
            ]
        }
    }
}